{
  "schema_version": "1.0",
  "case_id": "T1-MEM-001",
  "title": "Email service memory leak",
  "source_id": "otel-demo",
  "fault_type": "MEMORY_LEAK",
  "query": "The email service RSS keeps growing; diagnose retained memory.",
  "trigger": {
    "adapter": "otel_feature_flag",
    "action": "emailMemoryLeak",
    "parameters": {}
  },
  "topology": {
    "mode": "single_host_single_agent",
    "agent_deployment": "one_agent_per_host",
    "minimum_hosts": 1
  },
  "evidence_plan": {
    "snapshot_roles": [
      "incident",
      "baseline",
      "verification"
    ],
    "required_evidence": [
      "rss_growth",
      "memory_profile_growth"
    ]
  },
  "oracle": {
    "expected_scope": "service",
    "expected_root_cause": "email service retained memory growth",
    "expected_terminal_class": "PERFORMANCE",
    "expected_location_type": "self",
    "expected_domain_type": "memory",
    "expected_classification": "process_memory_pressure"
  },
  "execution": {
    "warmup_runs": 1,
    "repetitions": 3,
    "timeout_seconds": 600
  },
  "reference_ids": [
    "otel-demo-feature-flags"
  ]
}
