{
  "schema_version": "1.0",
  "case_id": "T1-NET-001",
  "title": "Frontend image path latency",
  "source_id": "otel-demo",
  "fault_type": "NETWORK_LATENCY",
  "query": "Frontend image requests are slow; locate the delayed dependency edge.",
  "trigger": {
    "adapter": "otel_feature_flag",
    "action": "imageSlowLoad",
    "parameters": {}
  },
  "topology": {
    "mode": "single_host_single_agent",
    "agent_deployment": "one_agent_per_host",
    "minimum_hosts": 1
  },
  "evidence_plan": {
    "snapshot_roles": [
      "incident",
      "baseline",
      "verification"
    ],
    "required_evidence": [
      "trace_edge_latency",
      "service_latency_change"
    ]
  },
  "oracle": {
    "expected_scope": "dependency_edge",
    "expected_root_cause": "injected delay on frontend image path",
    "expected_terminal_class": "PERFORMANCE",
    "expected_location_type": "downstream",
    "expected_domain_type": "network",
    "expected_classification": "downstream_dependency"
  },
  "execution": {
    "warmup_runs": 1,
    "repetitions": 3,
    "timeout_seconds": 600
  },
  "reference_ids": [
    "otel-demo-feature-flags"
  ]
}
